career_alignment_id,career_alignment_name,description,keyword_signals,example_programs
CAR-ACA,Akademik,"Berorientasi riset, teori, analisis mendalam, pendidikan lanjut, dan pengembangan ilmu.",riset|penelitian|akademik|teori|data|laboratorium|kuliah lanjut,Sains Data; Statistika; Kedokteran; Biologi; Kimia
CAR-SOC,Sosial,"Berorientasi membantu orang, layanan, edukasi, kesehatan, komunitas, dan dampak sosial.",membantu|masyarakat|mengajar|pasien|konseling|komunitas|pelayanan,Keperawatan; Psikologi; PGSD; Kesehatan Masyarakat
CAR-PRA,Praktikal,"Berorientasi praktik, teknik, troubleshooting, produksi, lapangan, dan implementasi langsung.",praktik|teknis|lapangan|mesin|jaringan|membangun|produksi,Teknik Mesin; Teknik Sipil; Teknologi Informasi; Agroteknologi
CAR-KRE,Kreatif,"Berorientasi ide, desain, visual, konten, media, seni, dan produk kreatif.",kreatif|desain|konten|video|musik|brand|visual|storytelling,DKV; Desain Produk; Film dan Televisi; Ilmu Komunikasi
CAR-EKS,Eksekutif,"Berorientasi bisnis, kepemimpinan, manajemen, organisasi, strategi, dan pengambilan keputusan.",bisnis|memimpin|manajemen|strategi|jualan|organisasi|negosiasi,Manajemen; Bisnis Digital; Akuntansi; Administrasi Publik
